{
  "$schema": "https://json-schema.org/draft/2020-12/schema",
  "$id": "https://resqlink.dev/schemas/publication.schema.json",
  "title": "Publication (Output)",
  "description": "Record of publishing an approved outreach artifact to an external channel. Created by POST /v1/artifacts/{id}/publish. The default connector is 'simulated' — it records the act and emits an outbox event but makes no real external post; only approved artifacts can be published.",
  "type": "object",
  "required": ["id", "incident_id", "artifact_id", "channel", "connector", "status", "created_at"],
  "properties": {
    "id": { "type": "string", "format": "uuid" },
    "incident_id": { "type": "string", "format": "uuid" },
    "artifact_id": { "type": "string", "format": "uuid", "description": "被發布的元件，必須為 approved。" },
    "channel": { "type": "string", "enum": ["facebook", "line"] },
    "connector": { "type": "string", "description": "連接器；目前為 simulated（未實際對外發文）。", "examples": ["simulated"] },
    "status": { "type": "string", "enum": ["published", "failed"] },
    "external_ref": { "type": ["string", "null"], "description": "外部參照（模擬連接器為 sim-… 前綴）。" },
    "detail": { "type": ["string", "null"] },
    "created_at": { "type": "string", "format": "date-time" }
  },
  "examples": [
    {
      "id": "55555555-5555-5555-5555-555555555555",
      "incident_id": "22222222-2222-2222-2222-222222222222",
      "artifact_id": "66666666-6666-6666-6666-666666666666",
      "channel": "facebook",
      "connector": "simulated",
      "status": "published",
      "external_ref": "sim-facebook-66666666",
      "detail": "模擬連接器：已記錄發布動作，未實際對外發文。",
      "created_at": "2026-06-16T08:05:00+08:00"
    }
  ]
}
