{
  "id": "55555555-5555-5555-5555-555555555555",
  "incident_id": "22222222-2222-2222-2222-222222222222",
  "artifact_id": "66666666-6666-6666-6666-666666666666",
  "channel": "facebook",
  "connector": "simulated",
  "status": "published",
  "external_ref": "sim-facebook-66666666abcd",
  "detail": "模擬連接器：已記錄發布動作，未實際對外發文。正式環境需設定 FB/LINE 憑證。",
  "created_at": "2026-06-16T08:05:00+08:00"
}
